{"$id":"urn:mcpaudit:evidence-conservation:CoverageDeltaV1","$schema":"https://json-schema.org/draft/2020-12/schema","additionalProperties":false,"properties":{"admission_status":{"enum":["CANDIDATE","ADMITTED","REJECTED"]},"body":{"additionalProperties":false,"properties":{"coverage_sha256":{"pattern":"^[0-9a-f]{64}$","type":"string"},"entries":{"items":{"additionalProperties":false,"properties":{"asserted_surface":{"minLength":1,"type":"string"},"case_id":{"pattern":"^P[123]-(?:C|0[1-6])$","type":"string"},"classification":{"enum":["COVERED","PARTIAL","CROSS_CONTRACT"]},"cross_contract_delta":{"minLength":1,"type":"string"},"missing_assertion":{"minLength":1,"type":"string"},"reviewer_rationale":{"const":"PENDING_INDEPENDENT_REVIEW"},"source_tests":{"items":{"minLength":1,"type":"string"},"minItems":1,"type":"array"}},"required":["case_id","classification","source_tests","asserted_surface","missing_assertion","cross_contract_delta","reviewer_rationale"],"type":"object"},"maxItems":21,"minItems":21,"type":"array"},"freeze_receipt_ids":{"items":{"minLength":1,"type":"string"},"maxItems":3,"minItems":3,"type":"array"},"new_claim":{"minLength":1,"type":"string"},"primary_counts":{"additionalProperties":false,"properties":{"covered":{"type":"integer"},"cross_contract":{"type":"integer"},"partial":{"type":"integer"}},"required":["covered","partial","cross_contract"],"type":"object"},"unmapped_count":{"const":0}},"required":["freeze_receipt_ids","entries","primary_counts","unmapped_count","new_claim","coverage_sha256"],"type":"object"},"content_sha256":{"pattern":"^[0-9a-f]{64}$","type":"string"},"created_at_utc":{"minLength":1,"type":"string"},"producer":{"additionalProperties":false,"properties":{"actor_id":{"minLength":1,"type":"string"},"role":{"minLength":1,"type":"string"}},"required":["actor_id","role"],"type":"object"},"record_id":{"minLength":1,"type":"string"},"reviews":{"items":{"additionalProperties":false,"properties":{"decision":{"enum":["ADMIT","REJECT"]},"independent_from":{"items":{"minLength":1,"type":"string"},"type":"array"},"rationale":{"minLength":1,"type":"string"},"reviewed_at_utc":{"minLength":1,"type":"string"},"reviewed_content_sha256":{"pattern":"^[0-9a-f]{64}$","type":"string"},"reviewer_id":{"minLength":1,"type":"string"}},"required":["reviewer_id","independent_from","decision","reviewed_at_utc","reviewed_content_sha256","rationale"],"type":"object"},"type":"array"},"schema":{"const":"CoverageDeltaV1"},"spec_sha256":{"pattern":"^[0-9a-f]{64}$","type":"string"},"supersedes":{"type":["string","null"]}},"required":["schema","record_id","spec_sha256","created_at_utc","producer","supersedes","body","content_sha256","reviews","admission_status"],"type":"object"}
