{"admission_status":"CANDIDATE","body":{"coverage_sha256":"37fc9defc16ff183123b5d1999fc873eb7e50ac20c34bb884adf7c090e1a3f1a","entries":[{"asserted_surface":"frozen path-local behavior identified in the approved coverage review","case_id":"P1-C","classification":"COVERED","cross_contract_delta":"common sealed oracle only","missing_assertion":"none declared by the approved frozen-source review","reviewer_rationale":"PENDING_INDEPENDENT_REVIEW","source_tests":["GithubRepoAuditor:tests/test_github_security_coverage.py::test_successful_empty_provider_response_is_explicit_completed_zero"]},{"asserted_surface":"frozen path-local behavior identified in the approved coverage review","case_id":"P1-01","classification":"COVERED","cross_contract_delta":"common sealed oracle only","missing_assertion":"none declared by the approved frozen-source review","reviewer_rationale":"PENDING_INDEPENDENT_REVIEW","source_tests":["GithubRepoAuditor:tests/test_portfolio_truth.py::test_receipt_partial_provider_coverage_emits_explicit_denominators"]},{"asserted_surface":"frozen path-local behavior identified in the approved coverage review","case_id":"P1-02","classification":"COVERED","cross_contract_delta":"common sealed oracle only","missing_assertion":"none declared by the approved frozen-source review","reviewer_rationale":"PENDING_INDEPENDENT_REVIEW","source_tests":["GithubRepoAuditor:tests/test_github_security_coverage.py::test_stale_provider_observation_becomes_unknown_count"]},{"asserted_surface":"frozen path-local behavior identified in the approved coverage review","case_id":"P1-03","classification":"PARTIAL","cross_contract_delta":"common sealed oracle closes the equivalence judgment","missing_assertion":"exact sibling plus normalized relation is not directly asserted","reviewer_rationale":"PENDING_INDEPENDENT_REVIEW","source_tests":["GithubRepoAuditor:tests/test_github_security_coverage.py::test_malformed_provider_payload_has_exact_fail_closed_reason_code"]},{"asserted_surface":"frozen path-local behavior identified in the approved coverage review","case_id":"P1-04","classification":"PARTIAL","cross_contract_delta":"common sealed oracle closes the equivalence judgment","missing_assertion":"exact sibling plus normalized relation is not directly asserted","reviewer_rationale":"PENDING_INDEPENDENT_REVIEW","source_tests":["GithubRepoAuditor:tests/test_github_security_coverage.py::test_total_request_ceiling_halts_incomplete_pagination"]},{"asserted_surface":"frozen path-local behavior identified in the approved coverage review","case_id":"P1-05","classification":"COVERED","cross_contract_delta":"common sealed oracle only","missing_assertion":"none declared by the approved frozen-source review","reviewer_rationale":"PENDING_INDEPENDENT_REVIEW","source_tests":["GithubRepoAuditor:tests/test_github_security_coverage.py::test_receipt_provenance_and_provider_timestamps_fail_closed"]},{"asserted_surface":"frozen path-local behavior identified in the approved coverage review","case_id":"P1-06","classification":"CROSS_CONTRACT","cross_contract_delta":"P1 producer-to-consumer binding seam","missing_assertion":"producer subject and head are dropped before the displayed consumer decision","reviewer_rationale":"PENDING_INDEPENDENT_REVIEW","source_tests":["GithubRepoAuditor:tests/test_github_security_coverage.py::test_receipt_producer_must_match_expected_canonical_commit","PortfolioCommandCenter:src/validation.test.ts"]},{"asserted_surface":"frozen path-local behavior identified in the approved coverage review","case_id":"P2-C","classification":"COVERED","cross_contract_delta":"common sealed oracle only","missing_assertion":"none declared by the approved frozen-source review","reviewer_rationale":"PENDING_INDEPENDENT_REVIEW","source_tests":["mcp-trust:tests/test_refresh_candidate.py::test_deterministic_fixture_candidate_is_immutable_and_reviewable"]},{"asserted_surface":"frozen path-local behavior identified in the approved coverage review","case_id":"P2-01","classification":"COVERED","cross_contract_delta":"common sealed oracle only","missing_assertion":"none declared by the approved frozen-source review","reviewer_rationale":"PENDING_INDEPENDENT_REVIEW","source_tests":["mcp-trust:tests/test_refresh_candidate.py::test_missing_receipt_is_explicit_and_not_fresh"]},{"asserted_surface":"frozen path-local behavior identified in the approved coverage review","case_id":"P2-02","classification":"COVERED","cross_contract_delta":"common sealed oracle only","missing_assertion":"none declared by the approved frozen-source review","reviewer_rationale":"PENDING_INDEPENDENT_REVIEW","source_tests":["mcp-trust:tests/test_refresh_candidate.py::test_exact_expiry_boundary_is_stale"]},{"asserted_surface":"frozen path-local behavior identified in the approved coverage review","case_id":"P2-03","classification":"COVERED","cross_contract_delta":"common sealed oracle only","missing_assertion":"none declared by the approved frozen-source review","reviewer_rationale":"PENDING_INDEPENDENT_REVIEW","source_tests":["mcp-trust:tests/test_refresh_candidate.py::test_masked_grade_is_withheld_from_results_and_snapshot"]},{"asserted_surface":"frozen path-local behavior identified in the approved coverage review","case_id":"P2-04","classification":"COVERED","cross_contract_delta":"common sealed oracle only","missing_assertion":"none declared by the approved frozen-source review","reviewer_rationale":"PENDING_INDEPENDENT_REVIEW","source_tests":["mcp-trust:tests/test_refresh_candidate.py"]},{"asserted_surface":"frozen path-local behavior identified in the approved coverage review","case_id":"P2-05","classification":"PARTIAL","cross_contract_delta":"common sealed oracle closes the equivalence judgment","missing_assertion":"exact sibling plus normalized relation is not directly asserted","reviewer_rationale":"PENDING_INDEPENDENT_REVIEW","source_tests":["mcp-trust:src/mcp_trust/refresh.py"]},{"asserted_surface":"frozen path-local behavior identified in the approved coverage review","case_id":"P2-06","classification":"PARTIAL","cross_contract_delta":"common sealed oracle closes the equivalence judgment","missing_assertion":"exact sibling plus normalized relation is not directly asserted","reviewer_rationale":"PENDING_INDEPENDENT_REVIEW","source_tests":["mcp-trust:tests/test_receipt_provenance.py"]},{"asserted_surface":"frozen path-local behavior identified in the approved coverage review","case_id":"P3-C","classification":"COVERED","cross_contract_delta":"common sealed oracle only","missing_assertion":"none declared by the approved frozen-source review","reviewer_rationale":"PENDING_INDEPENDENT_REVIEW","source_tests":["bridge-db:tests/test_recovery.py::test_create_anchor_is_private_and_disposable_recovery_verifies"]},{"asserted_surface":"frozen path-local behavior identified in the approved coverage review","case_id":"P3-01","classification":"COVERED","cross_contract_delta":"common sealed oracle only","missing_assertion":"none declared by the approved frozen-source review","reviewer_rationale":"PENDING_INDEPENDENT_REVIEW","source_tests":["bridge-db:tests/test_cli.py::test_recovery_anchor_cli_fails_closed_when_missing"]},{"asserted_surface":"frozen path-local behavior identified in the approved coverage review","case_id":"P3-02","classification":"COVERED","cross_contract_delta":"common sealed oracle only","missing_assertion":"none declared by the approved frozen-source review","reviewer_rationale":"PENDING_INDEPENDENT_REVIEW","source_tests":["bridge-db:tests/test_recovery.py::test_anchor_inventory_becomes_stale_after_same_count_update"]},{"asserted_surface":"frozen path-local behavior identified in the approved coverage review","case_id":"P3-03","classification":"PARTIAL","cross_contract_delta":"common sealed oracle closes the equivalence judgment","missing_assertion":"exact sibling plus normalized relation is not directly asserted","reviewer_rationale":"PENDING_INDEPENDENT_REVIEW","source_tests":["bridge-db:tests/test_recovery.py::test_anchor_detects_manifest_digest_mismatch"]},{"asserted_surface":"frozen path-local behavior identified in the approved coverage review","case_id":"P3-04","classification":"PARTIAL","cross_contract_delta":"common sealed oracle closes the equivalence judgment","missing_assertion":"exact sibling plus normalized relation is not directly asserted","reviewer_rationale":"PENDING_INDEPENDENT_REVIEW","source_tests":["bridge-db:tests/test_recovery.py::test_anchor_detects_backup_tampering"]},{"asserted_surface":"frozen path-local behavior identified in the approved coverage review","case_id":"P3-05","classification":"COVERED","cross_contract_delta":"common sealed oracle only","missing_assertion":"none declared by the approved frozen-source review","reviewer_rationale":"PENDING_INDEPENDENT_REVIEW","source_tests":["bridge-db:tests/test_recovery.py::test_anchor_detects_incompatible_schema_even_with_rebound_digest"]},{"asserted_surface":"frozen path-local behavior identified in the approved coverage review","case_id":"P3-06","classification":"PARTIAL","cross_contract_delta":"common sealed oracle closes the equivalence judgment","missing_assertion":"exact sibling plus normalized relation is not directly asserted","reviewer_rationale":"PENDING_INDEPENDENT_REVIEW","source_tests":["bridge-db:tests/test_recovery.py::test_anchor_inventory_becomes_stale_after_source_insert"]}],"freeze_receipt_ids":["freeze-receipt-p1-v1","freeze-receipt-p2-v1","freeze-receipt-p3-v1"],"new_claim":"common independently sealed oracle plus the P1 producer-subject-head binding seam only","primary_counts":{"covered":10,"cross_contract":1,"partial":7},"unmapped_count":0},"content_sha256":"f8d6ab2b43dbf3efe71fec0f86dd07592249bf96fc8d90bb96d2ad24cfc5ade4","created_at_utc":"2026-07-31T16:20:00Z","producer":{"actor_id":"codex","role":"EVIDENCE_PACKAGE_GENERATOR"},"record_id":"coverage-delta-v1","reviews":[],"schema":"CoverageDeltaV1","spec_sha256":"711b5c32b053a0e471b9d7e8b0327160d205a8bdfa88f207a92190990